{
  "id": "a5b0fe7d-c4dd-40a7-bd80-dfc7869327e1",
  "pan": "5434111122223333",
  "cvc": "123",
  "startDate": "0116",
  "expiryDate": "1219",
  "nameOnCard": "Mr Timmy Tester",
  "creationDate": "2011-05-30T12:13:14+03:00",
  "balance": {
    "amount": "1000",
    "currencyCode": "EUR"
  },
  "apr": 12.75
}